{
  "$schema": "https://json-schema.org/draft/2020-12/schema",
  "$id": "roadload.schema.json",
  "title": "Tesbox road-load table (roadload.json, generated)",
  "description": "Array of RoadLoadRecord (src/contracts.ts), SI units, written by tools/build-catalogue.ts. Unique refs are checked in tests.",
  "type": "array",
  "minItems": 1,
  "items": {
    "type": "object",
    "additionalProperties": false,
    "required": ["ref", "A_N", "B_Nps_m", "C_Ns2_m2", "source"],
    "properties": {
      "ref": { "type": "string", "pattern": "^[a-z0-9]+(-[a-z0-9]+)*$" },
      "A_N": { "type": "number", "minimum": 0, "maximum": 500 },
      "B_Nps_m": { "type": "number", "minimum": -20, "maximum": 20 },
      "C_Ns2_m2": { "type": "number", "minimum": 0.1, "maximum": 1.5 },
      "source": { "type": "string", "pattern": "^(EPA [0-9]{4} Test Car List: |derived: CdA=)" }
    }
  }
}
